{
  "meta": {
    "title": "Great Library of SISO · project",
    "description": "Project one pager for the Great Library of SISO: repos with heads, live URLs with codes, seats, landed, left, links.",
    "stream": "projects",
    "crumb": [
      {
        "label": "Templates",
        "href": "/"
      },
      {
        "label": "U4 · Project",
        "href": "/t/U4/"
      },
      {
        "label": "Great Library of SISO"
      }
    ],
    "actions": [
      {
        "label": "Front door",
        "href": "https://great-library-of-siso.pages.dev/",
        "icon": "arrow-up-right",
        "external": true
      },
      {
        "label": "projects.json row",
        "href": "https://github.com/sisodias/siso-agent-zero-protocol",
        "icon": "file-json",
        "external": true
      }
    ],
    "source": "plan/projects.json#library · gh api · curl 2026-09-06 19:28 UTC+07"
  },
  "heading": {
    "breadcrumb": [
      {
        "label": "Projects",
        "href": "/t/U4/"
      },
      {
        "label": "agency"
      },
      {
        "label": "library"
      }
    ],
    "kicker": "project <span class=\"sep\">·</span> agency <span class=\"sep\">·</span> <span class=\"dim\">the information front end</span>",
    "title": "Great Library of SISO",
    "subtitle": "The public registry and reading surface for SISO research, software and agent systems: Works, Releases, Snapshots, Assemblies. For Shaan and every cold agent: <em>\"it's all written in code but i need a way to actually see that shit\"</em>.",
    "badges": [
      {
        "label": "agency",
        "tone": "projects"
      },
      {
        "label": "live · 200",
        "tone": "now",
        "dot": true,
        "href": "https://great-library-of-siso.pages.dev/"
      },
      {
        "label": "owner LIBRARY-ZERO · idle",
        "tone": "agents"
      },
      {
        "label": "2 repos · both public",
        "tone": "muted",
        "href": "#repos"
      },
      {
        "label": "7 modules · 2 ok · 4 partial · 1 not started",
        "tone": "warn",
        "href": "#left"
      }
    ],
    "status": {
      "kicker": "Front door",
      "value": "great-library-of-siso.pages.dev",
      "note": "HTTP 200 at 19:28 UTC+07. 47 Works · 86 Releases · 40 Snapshots · 94 HTML pages (catalog.json, 6 Sep 13:42 build).",
      "facts": [
        {
          "k": "head",
          "v": "<code>477b775</code> · 6 Sep 13:42"
        },
        {
          "k": "shell",
          "v": "<code>siso-shell 388ce76</code> · 6 Sep 19:26"
        },
        {
          "k": "gls id",
          "v": "<code>gls:work:9b18cc64</code>"
        },
        {
          "k": "last writeback",
          "v": "6 Sep 12:52 · LIBRARY-ZERO"
        }
      ]
    },
    "jump": [
      {
        "label": "Front door",
        "href": "https://great-library-of-siso.pages.dev/",
        "live": true,
        "external": true
      },
      {
        "label": "Repos",
        "href": "#repos"
      },
      {
        "label": "Live URLs",
        "href": "#live"
      },
      {
        "label": "What is left",
        "href": "#left"
      },
      {
        "label": "Timeline",
        "href": "#timeline"
      },
      {
        "label": "Agent entry",
        "href": "#agent"
      }
    ],
    "metrics": [
      {
        "value": 2,
        "label": "repos",
        "unit": "both public",
        "tone": "projects",
        "href": "#repos"
      },
      {
        "value": 6,
        "label": "live URLs returning 200",
        "unit": "of 6",
        "tone": "now",
        "href": "#live",
        "note": "curl, 6 Sep 19:28 UTC+07"
      },
      {
        "value": 5,
        "label": "landed, with a receipt",
        "tone": "now",
        "href": "#landed"
      },
      {
        "value": 7,
        "label": "modules with verification lines",
        "unit": "4 partial",
        "tone": "warn",
        "href": "#left"
      },
      {
        "value": 3,
        "label": "seats that ran here",
        "tone": "agents",
        "href": "#seats"
      }
    ]
  },
  "sections": {
    "what": {
      "n": "01",
      "title": "What it is, in his words",
      "sub": "verbatim, dated"
    },
    "map": {
      "n": "02",
      "title": "Mind map",
      "sub": "repos · Works · questions · industries · people · nodes this project touches"
    },
    "repos": {
      "n": "03",
      "title": "Repos, incl. private",
      "sub": "head and time from gh api, 6 Sep 19:28 UTC+07"
    },
    "live": {
      "n": "04",
      "title": "Live URLs, with codes",
      "sub": "curl, 6 Sep 19:28 UTC+07"
    },
    "seats": {
      "n": "05",
      "title": "Owner seats and latest writeback"
    },
    "landed": {
      "n": "06",
      "title": "What landed",
      "sub": "verified against a remote or a URL; proposals are the seat's own claims"
    },
    "left": {
      "n": "07",
      "title": "What is left",
      "sub": "the module rows, each with its verification line (plan/modules.json)"
    },
    "research": {
      "n": "08",
      "title": "Research it rests on",
      "sub": "and what each means for this project"
    },
    "docs": {
      "n": "09",
      "title": "Docs, dated"
    },
    "timeline": {
      "n": "10",
      "title": "Timeline",
      "sub": "commits · seats · decisions · docs · his words, 5–6 Sep"
    },
    "links": {
      "n": "11",
      "title": "Links out",
      "sub": "the Works, questions, industries, people, decisions and pages this project leads to"
    },
    "agent": {
      "n": "12",
      "title": "Agent entry"
    }
  },
  "words": [
    {
      "text": "and also I think we should like make us some standardized for the great library size so we should make a bit more like each module should have a standardized page which is a bit better so like you can have the library with everything but each one should have its own page which is a bit nicer like when i click on one like we should just put some reasoning on it and i just like you know it'd be more human legible like nice title subtitle explaining what it is if there's any mind maps or whatever links of all other github repos associated",
      "who": "Shaan → Fable FA0",
      "at": "5 Sep 19:15"
    },
    {
      "text": "we need a bit more of a nicer information front-end system like i'm ai it's all written in code but i need a way to actually see that shit so i i guess that's what the great library is",
      "who": "Shaan → AGENT-ZERO",
      "at": "6 Sep 16:36"
    },
    {
      "text": "you're not using our size of crm side nav, which is Specifically what I told you to do And I feel like the templates for the pages are quite light So I think that's something we'll get Fable to do",
      "who": "Shaan → LIBRARY-ZERO",
      "at": "6 Sep 13:09"
    }
  ],
  "map": {
    "centre": {
      "label": "Great Library",
      "href": "https://great-library-of-siso.pages.dev/"
    },
    "types": [
      {
        "type": "repo",
        "label": "Repos",
        "tone": "projects",
        "items": [
          {
            "label": "great-library-of-siso",
            "href": "https://github.com/sisodias/great-library-of-siso",
            "rel": "source · public"
          },
          {
            "label": "siso-shell",
            "href": "https://github.com/sisodias/siso-shell",
            "rel": "shell · public"
          }
        ]
      },
      {
        "type": "work",
        "label": "Works",
        "tone": "projects",
        "items": [
          {
            "label": "great-library-of-siso",
            "href": "https://great-library-of-siso.pages.dev/works/great-library-of-siso/",
            "rel": "type library"
          },
          {
            "label": "siso-shell",
            "href": "https://great-library-of-siso.pages.dev/works/siso-shell/",
            "rel": "type tool"
          },
          {
            "label": "siso-project-os",
            "href": "https://great-library-of-siso.pages.dev/works/siso-project-os/",
            "rel": "V39 spine"
          },
          {
            "label": "siso-foundry",
            "href": "https://great-library-of-siso.pages.dev/works/siso-foundry/",
            "rel": "the one templated Work"
          }
        ]
      },
      {
        "type": "question",
        "label": "Questions",
        "tone": "research",
        "items": [
          {
            "label": "GQ-012 · context retention",
            "href": "https://great-library-of-siso.pages.dev/works/frontier-question-gq-012/",
            "rel": "published here"
          },
          {
            "label": "GQ-020 · industry operating systems",
            "href": "/t/U5/",
            "rel": "unpublished (falls to root)"
          },
          {
            "label": "GQ-023 · compute",
            "href": "https://great-library-of-siso.pages.dev/works/frontier-question-gq-023/",
            "rel": "D-20"
          }
        ]
      },
      {
        "type": "industry",
        "label": "Industries",
        "tone": "clients",
        "items": [
          {
            "label": "17 industries (Foundry)",
            "href": "https://great-library-of-siso.pages.dev/industries/",
            "rel": "renders"
          },
          {
            "label": "law_firms pilot",
            "href": "https://great-library-of-siso.pages.dev/industries/law_firms/",
            "rel": "live"
          }
        ]
      },
      {
        "type": "people",
        "label": "People · seats",
        "tone": "agents",
        "items": [
          {
            "label": "Shaan",
            "rel": "owner of the ask"
          },
          {
            "label": "LIBRARY-ZERO",
            "href": "/t/U17/",
            "rel": "seat · idle"
          },
          {
            "label": "TEMPLATE-BANK-ZERO",
            "href": "/t/U17/",
            "rel": "seat · shell + templates"
          }
        ]
      },
      {
        "type": "node",